{
  "version": 1,
  "patch": "DEMO",
  "updatedAt": "2026-10-15T12:00:00Z",
  "isDemo": true,
  "source": "Illustrative data. These are not real match statistics.",
  "roleStats": [
    {
      "heroId": 1,
      "role": "carry",
      "rank": "all",
      "matches": 1337,
      "wins": 735
    },
    {
      "heroId": 8,
      "role": "carry",
      "rank": "all",
      "matches": 2296,
      "wins": 1286
    },
    {
      "heroId": 44,
      "role": "carry",
      "rank": "all",
      "matches": 2228,
      "wins": 1248
    },
    {
      "heroId": 41,
      "role": "carry",
      "rank": "all",
      "matches": 1817,
      "wins": 1072
    },
    {
      "heroId": 18,
      "role": "carry",
      "rank": "all",
      "matches": 3666,
      "wins": 1980
    },
    {
      "heroId": 93,
      "role": "carry",
      "rank": "all",
      "matches": 3941,
      "wins": 2010
    },
    {
      "heroId": 48,
      "role": "carry",
      "rank": "all",
      "matches": 2776,
      "wins": 1332
    },
    {
      "heroId": 6,
      "role": "carry",
      "rank": "all",
      "matches": 2022,
      "wins": 1092
    },
    {
      "heroId": 109,
      "role": "carry",
      "rank": "all",
      "matches": 6133,
      "wins": 3373
    },
    {
      "heroId": 67,
      "role": "carry",
      "rank": "all",
      "matches": 5379,
      "wins": 2636
    },
    {
      "heroId": 42,
      "role": "carry",
      "rank": "all",
      "matches": 1954,
      "wins": 1055
    },
    {
      "heroId": 54,
      "role": "carry",
      "rank": "all",
      "matches": 3598,
      "wins": 1943
    },
    {
      "heroId": 70,
      "role": "carry",
      "rank": "all",
      "matches": 5790,
      "wins": 3358
    },
    {
      "heroId": 114,
      "role": "carry",
      "rank": "all",
      "matches": 1818,
      "wins": 982
    },
    {
      "heroId": 145,
      "role": "carry",
      "rank": "all",
      "matches": 6065,
      "wins": 3336
    },
    {
      "heroId": 13,
      "role": "mid",
      "rank": "all",
      "matches": 2981,
      "wins": 1729
    },
    {
      "heroId": 25,
      "role": "mid",
      "rank": "all",
      "matches": 4625,
      "wins": 2682
    },
    {
      "heroId": 11,
      "role": "mid",
      "rank": "all",
      "matches": 2707,
      "wins": 1516
    },
    {
      "heroId": 39,
      "role": "mid",
      "rank": "all",
      "matches": 1543,
      "wins": 741
    },
    {
      "heroId": 74,
      "role": "mid",
      "rank": "all",
      "matches": 1338,
      "wins": 709
    },
    {
      "heroId": 17,
      "role": "mid",
      "rank": "all",
      "matches": 3529,
      "wins": 1764
    },
    {
      "heroId": 106,
      "role": "mid",
      "rank": "all",
      "matches": 5722,
      "wins": 2804
    },
    {
      "heroId": 126,
      "role": "mid",
      "rank": "all",
      "matches": 3462,
      "wins": 1973
    },
    {
      "heroId": 46,
      "role": "mid",
      "rank": "all",
      "matches": 2502,
      "wins": 1226
    },
    {
      "heroId": 35,
      "role": "mid",
      "rank": "all",
      "matches": 5995,
      "wins": 3357
    },
    {
      "heroId": 22,
      "role": "mid",
      "rank": "all",
      "matches": 4214,
      "wins": 2065
    },
    {
      "heroId": 49,
      "role": "mid",
      "rank": "all",
      "matches": 2913,
      "wins": 1690
    },
    {
      "heroId": 52,
      "role": "mid",
      "rank": "all",
      "matches": 3324,
      "wins": 1828
    },
    {
      "heroId": 43,
      "role": "mid",
      "rank": "all",
      "matches": 2091,
      "wins": 1087
    },
    {
      "heroId": 2,
      "role": "offlane",
      "rank": "all",
      "matches": 1474,
      "wins": 825
    },
    {
      "heroId": 96,
      "role": "offlane",
      "rank": "all",
      "matches": 4352,
      "wins": 2350
    },
    {
      "heroId": 29,
      "role": "offlane",
      "rank": "all",
      "matches": 5173,
      "wins": 2742
    },
    {
      "heroId": 129,
      "role": "offlane",
      "rank": "all",
      "matches": 3873,
      "wins": 2208
    },
    {
      "heroId": 108,
      "role": "offlane",
      "rank": "all",
      "matches": 5996,
      "wins": 3238
    },
    {
      "heroId": 28,
      "role": "offlane",
      "rank": "all",
      "matches": 5036,
      "wins": 2921
    },
    {
      "heroId": 99,
      "role": "offlane",
      "rank": "all",
      "matches": 4763,
      "wins": 2429
    },
    {
      "heroId": 16,
      "role": "offlane",
      "rank": "all",
      "matches": 3392,
      "wins": 1967
    },
    {
      "heroId": 38,
      "role": "offlane",
      "rank": "all",
      "matches": 1406,
      "wins": 787
    },
    {
      "heroId": 55,
      "role": "offlane",
      "rank": "all",
      "matches": 3735,
      "wins": 2054
    },
    {
      "heroId": 137,
      "role": "offlane",
      "rank": "all",
      "matches": 4969,
      "wins": 2634
    },
    {
      "heroId": 69,
      "role": "offlane",
      "rank": "all",
      "matches": 5653,
      "wins": 3222
    },
    {
      "heroId": 97,
      "role": "offlane",
      "rank": "all",
      "matches": 4489,
      "wins": 2200
    },
    {
      "heroId": 49,
      "role": "offlane",
      "rank": "all",
      "matches": 2913,
      "wins": 1427
    },
    {
      "heroId": 26,
      "role": "support",
      "rank": "all",
      "matches": 4762,
      "wins": 2810
    },
    {
      "heroId": 27,
      "role": "support",
      "rank": "all",
      "matches": 4899,
      "wins": 2645
    },
    {
      "heroId": 86,
      "role": "support",
      "rank": "all",
      "matches": 2982,
      "wins": 1759
    },
    {
      "heroId": 7,
      "role": "support",
      "rank": "all",
      "matches": 2159,
      "wins": 1252
    },
    {
      "heroId": 123,
      "role": "support",
      "rank": "all",
      "matches": 3051,
      "wins": 1648
    },
    {
      "heroId": 9,
      "role": "support",
      "rank": "all",
      "matches": 2433,
      "wins": 1168
    },
    {
      "heroId": 100,
      "role": "support",
      "rank": "all",
      "matches": 4900,
      "wins": 2401
    },
    {
      "heroId": 71,
      "role": "support",
      "rank": "all",
      "matches": 5927,
      "wins": 2964
    },
    {
      "heroId": 101,
      "role": "support",
      "rank": "all",
      "matches": 5037,
      "wins": 2821
    },
    {
      "heroId": 119,
      "role": "support",
      "rank": "all",
      "matches": 2503,
      "wins": 1252
    },
    {
      "heroId": 88,
      "role": "support",
      "rank": "all",
      "matches": 3256,
      "wins": 1595
    },
    {
      "heroId": 5,
      "role": "hard-support",
      "rank": "all",
      "matches": 1885,
      "wins": 1112
    },
    {
      "heroId": 50,
      "role": "hard-support",
      "rank": "all",
      "matches": 3050,
      "wins": 1525
    },
    {
      "heroId": 111,
      "role": "hard-support",
      "rank": "all",
      "matches": 1407,
      "wins": 802
    },
    {
      "heroId": 30,
      "role": "hard-support",
      "rank": "all",
      "matches": 5310,
      "wins": 2867
    },
    {
      "heroId": 64,
      "role": "hard-support",
      "rank": "all",
      "matches": 4968,
      "wins": 2583
    },
    {
      "heroId": 31,
      "role": "hard-support",
      "rank": "all",
      "matches": 5447,
      "wins": 2669
    },
    {
      "heroId": 84,
      "role": "hard-support",
      "rank": "all",
      "matches": 2708,
      "wins": 1300
    },
    {
      "heroId": 83,
      "role": "hard-support",
      "rank": "all",
      "matches": 2571,
      "wins": 1363
    },
    {
      "heroId": 37,
      "role": "hard-support",
      "rank": "all",
      "matches": 1269,
      "wins": 698
    },
    {
      "heroId": 102,
      "role": "hard-support",
      "rank": "all",
      "matches": 5174,
      "wins": 2794
    },
    {
      "heroId": 79,
      "role": "hard-support",
      "rank": "all",
      "matches": 2023,
      "wins": 991
    },
    {
      "heroId": 87,
      "role": "hard-support",
      "rank": "all",
      "matches": 3119,
      "wins": 1778
    }
  ],
  "matchups": [
    {
      "heroId": 1,
      "otherHeroId": 8,
      "kind": "enemy",
      "matches": 188,
      "advantage": 3.6
    },
    {
      "heroId": 1,
      "otherHeroId": 8,
      "kind": "ally",
      "matches": 188,
      "advantage": 4.2
    },
    {
      "heroId": 1,
      "otherHeroId": 13,
      "kind": "enemy",
      "matches": 193,
      "advantage": 2.4
    },
    {
      "heroId": 1,
      "otherHeroId": 13,
      "kind": "ally",
      "matches": 193,
      "advantage": 3.0
    },
    {
      "heroId": 1,
      "otherHeroId": 26,
      "kind": "enemy",
      "matches": 206,
      "advantage": -4.8
    },
    {
      "heroId": 1,
      "otherHeroId": 26,
      "kind": "ally",
      "matches": 206,
      "advantage": -4.2
    },
    {
      "heroId": 1,
      "otherHeroId": 93,
      "kind": "enemy",
      "matches": 273,
      "advantage": 3.6
    },
    {
      "heroId": 1,
      "otherHeroId": 93,
      "kind": "ally",
      "matches": 273,
      "advantage": 4.2
    },
    {
      "heroId": 1,
      "otherHeroId": 25,
      "kind": "enemy",
      "matches": 205,
      "advantage": 3.6
    },
    {
      "heroId": 1,
      "otherHeroId": 25,
      "kind": "ally",
      "matches": 205,
      "advantage": 4.2
    },
    {
      "heroId": 1,
      "otherHeroId": 44,
      "kind": "enemy",
      "matches": 224,
      "advantage": -3.0
    },
    {
      "heroId": 1,
      "otherHeroId": 44,
      "kind": "ally",
      "matches": 224,
      "advantage": -2.4
    },
    {
      "heroId": 1,
      "otherHeroId": 2,
      "kind": "enemy",
      "matches": 182,
      "advantage": 3.0
    },
    {
      "heroId": 1,
      "otherHeroId": 2,
      "kind": "ally",
      "matches": 182,
      "advantage": 3.6
    },
    {
      "heroId": 1,
      "otherHeroId": 5,
      "kind": "enemy",
      "matches": 185,